{
  "$schema": "http://json-schema.org/draft-07/schema#",
  "title": "WorldFlex VFX Rules",
  "description": "Batch binding rules consumed by the WorldFlexVFXBind commandlet (-Rules=...). Speeds are component-space cm/s.",
  "type": "object",
  "required": ["bindings"],
  "properties": {
    "version": { "type": "integer" },
    "track": {
      "type": "string",
      "description": "Default Notify track name for all bindings.",
      "default": "WorldFlexVFX"
    },
    "remove_existing": {
      "type": "boolean",
      "description": "Default: clear existing events on the track before writing.",
      "default": false
    },
    "bindings": {
      "type": "array",
      "minItems": 1,
      "items": {
        "type": "object",
        "required": ["anim", "rules"],
        "properties": {
          "anim": {
            "type": "string",
            "description": "UE object path of the Animation Sequence, e.g. /Game/.../Mma_Kick.Mma_Kick"
          },
          "mesh": {
            "type": "string",
            "description": "Optional UE object path of the preview Skeletal Mesh."
          },
          "events_json": {
            "type": "string",
            "description": "Optional output path for detected events JSON. Relative paths resolve against the rules file directory."
          },
          "track": { "type": "string", "description": "Per-binding Notify track override." },
          "remove_existing": { "type": "boolean" },
          "rules": {
            "type": "array",
            "minItems": 1,
            "items": {
              "type": "object",
              "required": ["bone", "niagara"],
              "properties": {
                "rule": {
                  "type": "string",
                  "enum": ["speed_trail", "speed_peak_impact", "impact", "speed_peak", "run_loop", "run", "fixed_frame", "fixed"],
                  "default": "speed_trail"
                },
                "bone": { "type": "string", "description": "Bone name used for detection and as Notify SocketName." },
                "niagara": { "type": "string", "description": "UE object path of the Niagara System." },
                "speed_threshold": {
                  "type": "number",
                  "description": "Component-space speed threshold in cm/s. Calibrate using max/mean/suggested_threshold in bind_report.json.",
                  "default": 120.0
                },
                "min_duration": {
                  "type": "number",
                  "description": "Minimum trail duration in seconds (speed_trail / run_loop).",
                  "default": 0.08
                },
                "offset_after_peak": {
                  "type": "number",
                  "description": "Seconds after the speed peak to place the impact event (speed_peak_impact).",
                  "default": 0.06
                },
                "frame": {
                  "type": "integer",
                  "description": "Frame index for fixed_frame rules.",
                  "default": 0
                },
                "horizontal_only": {
                  "type": "boolean",
                  "description": "Measure horizontal (XY) speed only. run_loop rules default to true.",
                  "default": false
                },
                "location_offset": {
                  "type": "array", "items": { "type": "number" }, "minItems": 3, "maxItems": 3
                },
                "rotation_offset": {
                  "type": "array", "items": { "type": "number" }, "minItems": 3, "maxItems": 3,
                  "description": "[pitch, yaw, roll] in degrees."
                },
                "scale": {
                  "type": "array", "items": { "type": "number" }, "minItems": 3, "maxItems": 3
                }
              }
            }
          }
        }
      }
    }
  }
}
